job_id,title,location,department,salary_range,company_profile,description,requirements,benefits,telecommuting,has_company_logo,has_questions,employment_type,required_experience,required_education,industry,function,fraudulent
9938,Collections Specialist,"US, CT, Danbury",,,,"As a Collections Specialist you will be responsible for collection calls and/or correspondence in a fast paced goal oriented collections department.  Must provide excellent customer service regarding collection issues, process customer refunds, process and review account adjustments, resolve client discrepancies and short payments.  You will also be responsible for monitoring and maintaining assigned accounts and accountable for reducing delinquency for assigned accounts. Pay starts at $12.00-$12.50 per hour.",Must pass a criminal background checkMust have a valid drivers licenseMust have reliable transportationMust type 30-35 WPM,"Benefits are offered after a short temporary period at which point the employee will recieve health, dental and 401K. ",0,0,1,Full-time,Entry level,Unspecified,,Customer Service,0
9816,Portuguese speaking Team Leader - Malta   ,"MT, , Sliema ",,10000-20000,,"Job Purpose SummaryTo supervise, manage and motivate a group of International Customer Service Agents ensuring the achievement of key objectives to drive Customer Service and maximize proactive actions within his/her team.Job FunctionsLeading the team in day to day activities and ensuring team (e-mail/Live Chat/Phone) targets are exceeded and quality of service given to customers and internal departments.Leading and managing the proactive actions (outbound contacts) for required market ensuring that all targets are metTo manage the workloads/queues between the inbound and outbound priorities ensuring that the inbound KPI’s are met whilst maximizing the outbound potentialTo work with the marketing functions within the business to build sand grow the brand and profitability of the marketEnsuring that all company, departmental and individual objectives are clearly identified and communicatedManaging team productivity and general productivity adherence / driving the development of team members to maximize performance.Assessing performance and providing constructive feedback to develop and liaising closely with the Training and Quality team regarding team training needsManage all personnel issues in conjunction with company policyLiaising with other departments that have a direct impact on the customer journey (IT/WFP/Marketing etc)Providing status updates/reports to senior management (both scheduled and ad-hoc)To ensure that all company policies/regulations and Maltese laws are complied to at all times (both personally and all direct reports)All other duties as assigned ","Qualifications and Experience Minimum of one (1) year leading a Customer Service team of ten or more people Skills/Competencies RequiredWritten and spoken Portuguese skills at native levelWritten and spoken English at a fluent levelLeadership and Vision – Ability to inspire team with a clear vision and purposeStrong people management skillsAbility to establish, track and meet key performance indicators for the CS staff with regard to quality, efficiency, sales and customer satisfactionStrong customer service focus with the ability to work under pressureAbility to analyse/problem solve and deal with escalated complaintsStrong organizational, interpersonal, oral and written communication skillsAbility to interact with peers, senior management and other departments in a professional manner.​Effective time management skills &amp; a strong sense of initiativeA demonstrated ability to self-motivate, work in teams, and be flexible within a fast-paced and changing environmentVery result driven with good follow-up skills and an ability to manage high workloads and projects towards tight deadlinesA high working knowledge of Microsoft Excel, Word and PowerPoint",,0,0,0,Full-time,Not Applicable,High School or equivalent,Gambling & Casinos,Customer Service,0
15371,Experienced Travel Recruiter,"US, CA, Sacramento",,,"Who are We?Aya Healthcare is a top healthcare staffing organization because of our passionate, creative and talented employees. We have fun while we work and achieve results. We have grown 77% per year for the last 3 years and we are looking for more phenomenal talent to join our team of A-players. What Sets Us Apart?We are obsessive about creating great experiences for our clients and employees which makes us one of the best.  We will go the extra mile to make both our clients and employees happy.  We value our employees, recognize, and reward hard work.  You’re not just another number to us, you’re an important part of our team and we want to invest in you. Who are You?You are self-motivated and strive for resultsYou are just as obsessed as we are about creating great experiences for our clientsYou want to be a part of an organization that values your talentYou think outside the box","Experienced Travel Recruiter Position - Base salary plus commission, 401K with company match, medical benefitsWho are We?Aya Healthcare is a top healthcare staffing organization because of our passionate, creative and talented employees. We have fun while we work and achieve results. We have grown 77% per year for the last 3 years and we are looking for more phenomenal talent to join our team of A-players. What Sets Us Apart?We are obsessive about creating great experiences for our clients and employees which makes us one of the best places to work.  We will go the extra mile to make both our clients and employees happy.  We value our employees, recognize, and reward hard work.  You’re not just another number to us, you’re an important part of our team and we want to invest in you. Who are You?You are self-motivated and strive for resultsYou are just as obsessed as we are about creating great experiences for our clientsYou want to be a part of an organization that values your talentYou think outside the boxWe are currently seeking a qualified individual for a travel recruiter position. The successful candidate will receive complete training and work on a team of motivated, positive and energetic individuals.An Experienced Travel Recruiter is responsible for:Identifying and Recruiting qualified Nurses or Therapists for short-term and long-term assignments.Making outbound calls to potential and existing candidates by telephone and e-mail to qualify them for potential job opportunities. Educating prospective candidates on the benefits of Travel and Local contractsGenerating candidate leads through planning and persistence. Building and maintaining candidate relationships.",The successful candidate will possess:1-5 years Travel Nursing or Travel Therapy staffing experienceExcellent communication skillsLeadership abilityHigh energy levelsA college degree,"What are the Perks?Aggressive compensation for successful recruitersPTO, 401K matchFree medical, dental, life and vision insuranceFree food, snacks, and coffee in our kitchenFree Yoga and Boot camp classesCompany Sponsored Happy Hours and Events Birthday CelebrationsWork/life balance  E.O.E. Hiring Organization: Aya Healthcare",0,1,0,Full-time,,Bachelor's Degree,Staffing and Recruiting,Sales,0
16953,Sales and Marketing team expanding. Hiring immediately,"US, KY, Lexington",,55-125,"LEI Home Enhancements, is an Ohio based company that has been installing windows, siding, doors and decks in homes throughout the Tri-state, Dayton, Indianapolis and Columbus for over seven years.With pride in our work, honesty and integrity in our professionalism and a companywide dedication to customer satisfaction, we offer a wide range of remodeling services to homeowners.Whether your project is large or small, we understand the trust and confidence each customer places in our skilled hands.  That's why we use only superior quality products and exceptional craftsmanship to achieve long-lasting beauty, performance and value for your home.  We take every measure to carefully ensure our craftsman are properly trained in all phases of home improvement.  Likewise, our sales staff and customer service representatives draw upon their years of experience for quality installations.From day one, we will welcome any questions and concerns you may have during the renovation process.  It is our goal to provide you with beautiful and practical home improvements that will stand the test of time, along with the peace of mind that you have made an excellent selection for your home.","LEI is a leading Sales, Marketing and Promotional Company with multiple locations around the country. Here at LEI  we bring together our proven Direct Marketing expertise  that reflect the utmost professional experience for our customers and clients alike. We will continue to expand to several cities in 2014. Our  Sales and Marketing Teams are looking for 10+ Ambitious &amp; Fun individuals to start IMMEDIATELY. We are looking for self-motivated people we can coach and train intensively to work with our clients, to specialize in Sales, Marketing, and Customer Services for our busy promotion campaigns.",The role would require you to excel in:  • Customer interaction and  communications • Client product knowledge  • Major client representation  • Campaign development.,What's in it for you?   -Fantastic earning potential  (base/commission/bonus) -The opportunity to be cross coached in all aspects of Sales &amp; Marketing  -Development of interpersonal skills and confidence  -Chance to gain nationally recognized qualifications  -Advancement based on individual merit and performance  -Rapid progression &amp; Business Development opportunities  -Opportunities for national travel,0,1,0,,,,,Marketing,0
3246,Hiring for Business Analyst,"US, NJ, albany",,,,We are looking for Entry Level Business Analysts/Quality Analysts/Financial Analyst We presently have openings for Business Analysts/Quality Analysts/Financial Analyst and we are looking for fresh BS/MS/IT graduates for our multiple positions of Business Analysts/Quality Analysts/Financial Analyst. ,"Required Skills:*BS/MS in all streams like Computer Science, Information Technology, Engineering, Finance, MBA.*Great communication skills/presentation skills.*Some years of business and system analysis, management, and project planning experience/knowledge.*Ability to communicate business users needs to technical staff.*MS Office: Word, Excel, Powerpoint, Visio*Capable of learning new technology in a fast paced environment.* Send me your resume.",,0,0,0,Contract,,,Information Technology and Services,Information Technology,0
8378,Phone Sales,"US, CA, Encino",Outbound Sales,,"For over 20 years NAC Marketing Company, LLC d/b/a New Vitality has helped people be healthy and live better by marketing and selling vitamins, health supplements, and personal care products. Our customers learn about our products through direct marketing advertisements which use celebrities, athletes and doctors to promote on radio and television stations across North America.We offer a wide variety of career and entry-level positions as well as internships in a fast-paced and exciting industry. Our 100+ employees hold positions in Marketing, Creative, eCommerce, Media-Buying, Product Development, Accounting, Human Resources, Operations and Inbound &amp; Outbound Sales in both our New York and California offices. WORK HEALTHYWe believe in the philosophy ‘be healthy, live better’  for our customers and especially for our employees. We encourage healthier lifestyles through affordable benefits, gym reimbursement programs (through medical insurance) and company events that promote physical activity and company morale.Affordable Medical, Dental &amp; Vision InsuranceFlexible Spending Account &amp; Dependent CareCompany-paid Life Insurance &amp; Long-Term DisabilityEmployee Discounts on New Vitality products WORK BETTERWe believe growth and development are necessary parts of a rewarding work experience so we offer opportunities to gain industry knowledge, discover and utilize new skills and advance within the company. We also keep it fun with annual events like our Holiday Party, Thanksgiving Feast &amp; Dessert Contest and team participation in Long Island's Marcum Workplace Challenge at Jones Beach.Paid Training for Call Center EmployeesLunch &amp; Learn SeminarsSafety CommitteeCommunity Involvement (Toys for Tots, Island Harvest)Paid Time OffRoom for Advancement See below for our current opportunities. Follow the link to apply and if you are a qualified candidate, a member of our Human Resources department will reach out to you. NAC Marketing Company, LLC is an Equal Opportunity Employer encouraging diversity in the workplace. All qualified applicants will receive consideration for employment without regard to race, national origin, gender, age, religion, disability, sexual orientation, veteran status, marital status or any other characteristic protected by law.","Hours: Monday through Friday 1:00pm-9:00pm  Starting Salary: $14/hour, no commissionAfter 3-Week Training Period: $12/hour plus commission and bonuses  Job Responsibilities:Calling on, building relationships &amp; securing orders from existing New Vitality customers(Absolutely NO cold calling!)Inform and enlighten customers about our new products and promotionsUp-sell and cross-sell New Vitality productsEnter customer orders into a computer systemHandle secure information with discretionDepending on the needs of the business, you will be required to work holidays if we remain openAttendance is an essential responsibility of this positionSchedules are determined by business demands",Requirements: 6 months work experienceHigh school diploma or GEDSolid computer skills (MS applications)Excellent reading and phone etiquettePatience and upbeat professional mannerAbility to type 35-40 words per minuteAbility to verbally convey information to others effectivelyAbility to read and understand information presented in writingAbility to multi-taskAbility to sit for long periods of time,"Benefits: We believe in the philosophy ‘be healthy, live better’ for our customers and especially for our employees. Therefore we provide an environment where our employees can grow and advance professionally as well as in their personal lives. We reward and recognize hard work by promoting from within and we encourage healthier lifestyles through affordable benefits and company activities that promote physical activity and company morale.Paid Time Off (will begin to accrue on the 1st of the month after 90 days of service)Medical, Dental &amp; Vision (after 90 days of service)Flexible Spending Account (1st of the month after 90 days of service)401k plan (automatic enrollment on first day of employment)Company-paid Life Insurance &amp; Long-Term Disability (1st of the month after 1 year of service)Paid trainingEmployee discounts on New Vitality productsCasual work environmentRoom for advancement as your department and the company grow This job description does not constitute an employment contract or guarantee of continued employment. Employment is “At-Will” which means that employees may terminate their employment at any time. Similarly, the company may terminate the employees’ employment at any time, with or without cause and with or without notice.",0,1,1,Full-time,Entry level,High School or equivalent,Consumer Goods,Sales,0
9665,Marketing Revenue Manager,,,,Massive Media is the social media company behind the successful digital brands #URL_18234f381f5e7b9a9ffdc727cd05c9046edffb45bce85533c8f9b6d0216e925e# and #URL_af2b2f34d003dd6238fb60ec002a2f9df551ec9f8c6df8c980fc4fd8d24cc707#. In November 2013 Massive Media bought and relaunched the social discovery platform Stepout. We enable members to meet nearby people instantly. Over 100 million people have joined our sites on web and mobile.,"Our team needs a person with flair, turning potential into reality. Are you the one?Identifying, acquiring, retaining and converting high value segments is something you do in between jogging and breakfast?    You feel you master all possible scenarios for developing well-balanced free-to-paid conversion strategies and tactics?    You know how to tease and please?    Increasing retention and satisfaction of paying users seems like a piece of cake?    Global payment and pricing strategy…did you say you were an expert? Are you ready to rock and roll?Apply here",,,0,1,1,,,,,,0
4346,Marketing Representative,"US, GA, Atlanta",,,"Tidewater Finance Co. was established in 1992 for the initial purpose of purchasing, and servicing retail installment contracts. There are two divisions: Tidewater Credit Services, providing indirect consumer retail finance options and Tidewater Motor Credit, providing indirect consumer auto financing. We remain committed to offering a partnership with the dealers and consumers to create a WIN-WIN-WIN situation. Our success relies solely on the success of our dealers and our consumers.Full time positions include the following benefits:40 vacation hours after 6 months of employment, 80 vacation hours after 1 year of employment6 paid holidays as well as an anniversary holiday benefitPaid personal and sick leave after 90 days of employmentFull benefits to include health, dental, life and disability insuranceA 401k plan with a company match after 6 months of employment based upon a quarterly entry dateIncentive bonuses for individual and team goals (certain positions)Bilingual Spanish eligible for differential pay","Financial Services Company is seeking a full-time Marketing Representative to add to our sales team. Qualified candidates should possess a strong background in customer relations and business development, familiarity with the finance industry, automotive or other is a plus. Primary responsibilities include, but are not limited to the following:Maintaining and building automobile dealer relationships via contact through phone, email, direct visits and other correspondence.  Facilitate new dealer sign-up to include background investigation and provide ongoing training and coordination.Source current relationships and prospects for developing joint marketing initiativesFollow-up of pending credit applications and contracts.Prepare and analyze activity reports, monitor trends, increase sales market penetration and share strategies to maintain competitive advantages. This position requires the following qualifications:Previous finance, auto financing or auto dealer experience in the areas of sales/marketing, underwriting or customer service preferredStrong customer service skillsAbility to multi-task and work independentlyTime management and organization skillsProficient in Microsoft Office Suite a mustEffective communication skills; written, verbal and listeningThe standard hours for this position are:Monday through Friday with some adjustments required to accommodate dealer operating hours on Saturdays.Must be able to travel within assigned territory, monthly overnights approximately 15% of the time.Our company offers a competitive salary as well as a comprehensive benefits package to our full-time employees, including: paid vacation, holidays, sick time, health, dental, life and supplemental insurance and 401k.Company is an equal opportunity employer in all aspects of employment without regard to race, age, sex (including pregnancy), marital status, religion, disability, genetic information, military status or any other characteristic or status protected by law.  ","This position requires the following qualifications:Previous finance, auto financing or auto dealer experience in the areas of sales/marketing, underwriting or customer service preferredStrong customer service skillsAbility to multi-task and work independentlyTime management and organization skillsProficient in Microsoft Office Suite a mustEffective communication skills; written, verbal and listening","Our company offers a competitive salary as well as a comprehensive benefits package to our full-time employees, including: paid vacation, holidays, sick time, health, dental, life and supplemental insurance and 401k.",0,1,0,Full-time,Associate,Unspecified,Financial Services,Sales,0
