job_id,title,location,department,salary_range,company_profile,description,requirements,benefits,telecommuting,has_company_logo,has_questions,employment_type,required_experience,required_education,industry,function,fraudulent
1558,Web Developer (Intern) ,"GR, I, Athens",,,Το #URL_bb79581a561837ad604b8fc4ab629753b36407cc3bc76c42e6e46d74bb78eba2# είναι μία επαγγελματική διαδικτυακή πλατφόρμα μέσω της οποίας έρχονται σε επαφή εργοδότες και Δουλευταράδες για την εκτέλεση μιας εργασίας ή για τη σύναψη μιας νέας συνεργασίας. ,"Το #URL_bb79581a561837ad604b8fc4ab629753b36407cc3bc76c42e6e46d74bb78eba2# αναζητεί φιλόδοξο και ταλαντούχο Web Developer για πρακτική άσκηση 2 μηνών, με προοπτικές μόνιμης απασχόλησης μετά το πέρας αυτής.Τι είναι το #URL_bb79581a561837ad604b8fc4ab629753b36407cc3bc76c42e6e46d74bb78eba2#;Το #URL_bb79581a561837ad604b8fc4ab629753b36407cc3bc76c42e6e46d74bb78eba2# είναι μία επαγγελματική διαδικτυακή πλατφόρμα μέσω της οποίας έρχονται σε επαφή εργοδότες και Δουλευταράδες για την εκτέλεση μιας εργασίας ή για τη σύναψη μιας νέας συνεργασίας. Βρίσκεται στον “αέρα” περίπου 3 μήνες, έχοντας τύχει ευρύτερης υποδοχής από εργοδότες και επαγγελματίες, καταγράφοντας εντυπωσιακή ανάπτυξη σε αριθμό μελών και εργασιών. ","ΑπαιτούμεναΦοιτητής/Απόφοιτος ΑΕΙ ή ΤΕΙ Πληροφορικής.Πολύ καλή γνώση/αντίληψη προγραμματισμού. Καλή γνώση τεχνολογιών διαδικτύου (HTML, CSS, Javascript).Κατανόηση και αντίληψη συστημάτων βάσεων δεδομένων.‘Ορεξη για δουλειά, πάθος για την τεχνολογία/ανάπτυξη λογισμικού/software engineering.Portfolio με παρόμοιες εργασίες/projects. Θα συνεκτιμηθούν (αλλά δεν είναι απαραίτητα)Γνώση ανάπτυξης εφαρμογών σε Python και Django.PostegreSQL.Agile τεχνικές ανάπτυξης λογισμικού.",ΠρονόμιαΣυμμετοχή σε μια ταχύτατα αναπτυσσόμενη start-up που έχει συγκεντρώσει ενδιαφέρον από όλη την Ελλάδα.Συνεργασία με μια πολυμορφική και έμπειρη ομάδα που αποτελείται από στελέχη με διεθνή καριέρα.Επιπλέον δυνατότητες απολαβών ανάλογα με την προσφορά στην ομάδα.Δυνατότητα εργασίας από απόσταση.,0,1,1,Temporary,Internship,,,,0
102,English Teacher Abroad ,"CA, MB, Winnipeg",,,We help teachers get safe &amp; secure jobs abroad :),"Play with kids, get paid for it Love travel? Jobs in Asia$1,500+ USD monthly ($200 Cost of living)Housing provided (Private/Furnished)Airfare ReimbursedExcellent for student loans/credit cardsGabriel Adkins : #URL_ed9094c60184b8a4975333957f05be37e69d3cdb68decc9dd9a4242733cfd7f7##URL_75db76d58f7994c7db24e8998c2fc953ab9a20ea9ac948b217693963f78d2e6b#12 month contract : Apply today ",University degree required. TEFL / TESOL / CELTA or teaching experience preferred but not necessaryCanada/US passport holders only,See job description,0,1,1,Contract,,Bachelor's Degree,Education Management,,0
4280,Infrastructure Specialist AIX/UNIX ,"PH, , Quezon City",IT,,,"Infrastructure Specialist AIX/UNIXSkill name Support Operating System Analyze System Level Performance &amp; Capacity Perform Product Conversion System Fixes Support Web Servers Analyze Specific Package Architecture Impacts Advise on IT Infrastructure Management Perform -AIX/UNIX  Perform Plan, Implement &amp; Custmz Sys Mgmt Knowledge of Asset Management Knowledge of Availability Management Knowledge of Capacity Management Knowledge of Change Management Knowledge of Configuration Management Knowledge of Incident Management Knowledge of Problem Management Knowledge of Release Management Knowledge of Security Management Knowledge of Service Continuity Knowledge of Service Level Management  Develop Operations Functions &amp; Recovery Procedures  Design Systems Management Strategy  Lead Systems Management Function Improvement  Use Systems Management Method or Best Practices  Use Systems Management Toolsskill:- Project Coordinator, Architecture, COM, Management, AIX, Java, Change Management, PHP, J2ME, Asset Management, UNIX","Infrastructure Specialist AIX/UNIXSkill name Support Operating System Analyze System Level Performance &amp; Capacity Perform Product Conversion System Fixes Support Web Servers Analyze Specific Package Architecture Impacts Advise on IT Infrastructure Management Perform -AIX/UNIX  Perform Plan, Implement &amp; Custmz Sys Mgmt Knowledge of Asset Management Knowledge of Availability Management Knowledge of Capacity Management Knowledge of Change Management Knowledge of Configuration Management Knowledge of Incident Management Knowledge of Problem Management Knowledge of Release Management Knowledge of Security Management Knowledge of Service Continuity Knowledge of Service Level Management  Develop Operations Functions &amp; Recovery Procedures  Design Systems Management Strategy  Lead Systems Management Function Improvement  Use Systems Management Method or Best Practices  Use Systems Management Toolsskill:- Project Coordinator, Architecture, COM, Management, AIX, Java, Change Management, PHP, J2ME, Asset Management, UNIX","Collabera is a fast growing, end-to-end information technology services and solutions provider working with leading Global 2000 organizations from the Banking &amp; Financial Services, Telecommunications &amp; Media, Technology, Energy &amp; Utilities and Manufacturing &amp; Retail domains. Collabera delivers highly responsive and innovative solutions that help clients align their IT strategy with business goals to address the most important IT needs through a combination of consulting solutions, proprietary methodologies, assets based services and a Collaborative Engagement Model.Collabera employs over 8000 professionals across more than 25 offices and 4 world-class delivery centers in the U.S., UK, India, Singapore and Philippines. We deliver a full portfolio of services that include Consulting, Application Development &amp; Management, Independent Testing Services, Enterprise Software Solutions, Product Engineering Services, Business Intelligence &amp; Data Warehousing, Mobile and Wireless, Infrastructure Management as well as Professional Services.",0,0,1,,,,,,0
17805,Account Manager,"US, CA, Los Angeles",sales,,,"Account ManagerJoin a growing team that combines the excitement of a startup with the stability of the biggest name in personal development!Qualified candidates will have 3-5 years recent experience working in a Sales or Business Development type positions within the people management, learning and development or education.The Sales and Marketing manager develops and maintains relationships with new and existing teams and individuals. Ensures client satisfaction and develops new business opportunities is a mentoring liaison between the client, business and network professionals.Why ESP Outsourcing?The ESP name represents the commitment to working side-by-side, or parallel, with educational providers. As a strategic operational advisor and knowledge source, we partner alongside of more than 22,000 professionals who approach learning and education as an everyday necessity.","Requirements  High School Diploma  Current 3-5 years working in an Sales and Marketing  type roles within national or international education.  Excellent interpersonal skills  Excellent oral and written communication skills  Utilizes excellent customer service skills at all times  Ability to multi-task and work in a team environment  Experience using marketing both traditional and social media      Personality, stand out in a crowd a true winner ",,0,0,0,Part-time,,High School or equivalent,E-Learning,Sales,1
5767,Auditor,"US, MO, St. Louis",,,"We Provide Full Time Permanent Positions for many medium to large US companies. We are interested in finding/recruiting high quality candidates in IT, Engineering, Manufacturing and other highly technical and non-technical jobs.","(We have more than 1500+ Job openings in our website and some of them are relevant to this job. Feel free to search it in the website and apply directly. Just Click the “Apply Now” and you will redirect to our main website where you can search for the other jobs.)#URL_94f805e93a6fa859cd8540e9767e187e295d764a384221d77f8880142b6416b7#-#URL_dbdb917780b325918ec611d0f47d6a0dff5ee871b96bc71180616d0d0570925b#The Senior Accountant will contribute to and/or lead client engagements and will supervise the field work of junior staff accountants on assurance &amp; audit related initiatives. Client engagements will vary in size, scope and industry and may include the involvement of managers and partners.Job Requirements:A strong desire for continuous learning and career advancementAbility to travel regionally for client engagements as neededExperience working with clients from a variety of industriesQualifications Required:Bachelors degree in Accounting or FinanceCPA certification or JD requiredJob Responsibilities:BudgetingSEC FilingsAnnual ReportsJob Title: Jr. Auditor - 3 years accounting experience - Cincinnati, OHJob Location: Job is in Cincinnati, OH",,,0,0,0,Full-time,,,Accounting,,0
745,Event Staff - Live In-Stores Infomercial ,"US, NY, New York City",,,,Demonstrators that love being in front of an audience and having fun working promotional events needed. All presentations are like performing a Live In Person Infomercial.We are hiring for North America's Leading Product Demonstration Company. This is not your typical Promotions company so come join a fun and dynamic company where the job never feels like work! All promotions are structured and well organized. We supply staging equipment and products to all events. We are hiring talented individuals that like talking to customers about Environmentally Friendly products and can work events throughout the greater New York City area.Flexible schedule.Consistent work opportunity available.Earn an average of $400-$800 per week.Paid Weekly.Guarantee pay per event.Worldwide travel opportunities.,,,0,0,1,Full-time,Not Applicable,Unspecified,Consumer Goods,Sales,0
6585,BI Practice Director,"US, TX, PLANO",,,"Visual BI is one of the leading and fastest growing firms focusing exclusively on BI &amp; Analytics. Our offerings cover end-to-end BI services, industry and domain-specific solutions, custom visualization controls (SAP Dashboards and SAP Design Studio) and cloud-based analytics.Headquartered in Plano, Texas, Visual BI has won recognition from customers for driving high-touch engagements driven by our team of platinum-level experts, an agile delivery model and innovative solutions.Highlights:* Ranked by CIOReview as one of the Top 100 Big Data Companies in the US* Dedicated Visual BI Labs facility in San Antonio, TX, to support R&amp;D and innovations* Partnerships with established vendors such as SAP, TIBCO Spotfire, Tableau and MongoDB* A culture that encourages to look forward and think aheadMission: Our Goal is to become one of the leading firms worldwide in terms of brand recall &amp; excellence in the field of Business Intelligence &amp; Analytics by driving BI adoption with our innovative analytical solutions and applications.","Build Visual BI's BI Center of Excellence and BI Practice Competencies Become Integral Part of Visual BI's Vision to be the Best BI Consulting and Solutions Firm Execute BI Strategy by leveraging SAP BW and HANA capabilities as Enterprise Data Warehouse(EDW). Provide solutions architecture oversight for new development projects in support of our client's BI programBuild Project Plan timelines and Ensure BI Project Executions to those timelines and budget. Ensure adoption of best-in-class practices and standards for development, support, quality control and documentationWork with stakeholders to analyze business requirements, and define target SAP BI/BW solution architecture and associated technical specifications &amp; implementation planLead large cross functional teams including client staff and implementation team to accomplish successful completion of one or more solution requirements, architecture, or implementation deliverablesExcellent BI Thought Leadership and Content writing for Blogs and Visual BI News Letters Write Detailed and Descriptive Proposals, Statement of Work (SOW), and Project Plans Manage and Develop of Visual BI team of Consultants and Developers Work independently with minimal supervisionWill be required to commit to 75% travel or relocate to client locations  ","5+ Years of Experience in Managing BI Projects and Enterprise BI Architecture 10+ years of hands-on experience in multiple SAP BW developments2+ Years of hands-on experience in HANA Modelling Experience with Modeling and Architecting for Non SAP Datasources Upstream Oil and Gas Industry Experience 75% Travel or Relocation to Client Locations Business Objects Experience Visualizations Tools Experience (Tableau, TIBCO Spotfire, QlikView) ","Excellent Pay Excellent Medical, Dental, Vision, Life, AD&amp;D, Dependent Life, Short Term and Long Term Disability Benefits401(k) plan administered through employee fiduciaryGenerous communication allowance (mobile / internet / data charges)",0,1,1,Full-time,Director,Bachelor's Degree,Information Technology and Services,Information Technology,0
14050,Implementation Manager,"US, CA, Irvine",,80000-100000,"Orange County Tech Recruiters is based in Orange County and focuses on finding full time technical talent for clients in California with particular emphasis on OC, LA, SF and San Diego.  We are a small focused team and each of us have 20+ years in technology and technology recruiting.  Please see our LinkedIn profiles and recommendations below: Robert Ardell - #URL_b6d48964c0b9b0074359c7a207623fd2360c853a418da3bfa1c6c18f79a1a6f6#Jake Villarreal - #URL_8bfb8c2cfcf91aeb1253da2a322b5617a4f92bd358eb0badeefafa67450370af#","We are a growing and profitable software company looking to hire a full-time Implementation Manager into our Product &amp; Technology department.  We have an employee centric culture and experience very little attrition.  We have 60 employees and have been in business for 13+ years now.  We offer a generous benefits package including a no-waiting-period health insurance program.Position SummaryUnder the direction of the Management Team of the Products &amp; Implementation Department, the Implementation Manager will lead projects responsible for ensuring that our clients are fully and correctly implementing our products and services as well as industry best practices.  Additionally, the Implementation Manager will help to establish and maximize product and technology partnerships.","Essential FunctionsLead implementation projects of all sizes for customers ranging from Fortune 500 enterprises to startup e-commerce businessesManage complete project life cycle, from post-sales to production, to ensure the full and correct implementation of all applicable products and servicesEffectively setting and managing expectations of high profile and high demand customersAct as a resource internally for all Company productsWork in technical environments with discussions regarding system networking, hosting environments, and/or development languages with highly technical project team membersAlign all work to company Mission, Values and VisionAbility to work independently while managing multiple projects and deliverablesAbility to make business critical decisions based on knowledge, experience, and judgment with some direction from managementAnalytical skills with experience in the management and/or development of software based products and servicesBe dedicated, reliable, details and solutions orientedMust thrive in a fast-paced, dynamic and diverse environmentStrong interpersonal communication, organizational, and writing skillsMust possess the highest level of integrity, professionalism and excellencePractical experience with computer programs such as Microsoft Office and project tracking tools such as Microsoft Project, AtTask, or other project tracking programs3+ years of Project and/or Relationship Management with a focus on technical products and services2+ years working with PCI complianceBachelors degree in Business or Information Systems a plusPMP/CAPM certification a plusNote:  Successful applicants must submit to a pre-employment background check and drug screen ",We offer a bonus structure after one year of employment as well as a generous benefits package including a no-waiting-period health insurance program.,0,0,1,Full-time,Mid-Senior level,Vocational,Information Technology and Services,Project Management,0
14082,Content Architect,"US, NY, New York",IT,,"ValleySoft is a fast growing global IT Services &amp; Solutions company based in Silicon Valley, USA . At ValleySoft, we strongly believe that excellence in services to Client is not a singular act, but a habit. We make earnest effort in our constant endeavor to redefine this habit and take it to the next higher level. Our long standing, time tested experience, which span across domains, is a source of strength as it helps us effectively leverage our experience to add value to our Clients' business needs and processes. Our growth has been powered by our consultative approach, our deep understanding of business and technology, our passion for innovation - and above all, our integrity.","• In-depth understanding of the Content Domain • Experience in leading product development initiatives in the publishing space • Good understanding of the education domain especially digital learning is preferable • Experienced in working with Enterprise Content management systems • Experienced in designing content and meta-data models • Proficient in architecting and designing Content transformations, enrichment, workflows, search and analytics • Experienced in working on XML based systems and solutions • Good understanding of enterprise architecture, data integration , service oriented architecture and underlying infrastructure • Ability to drive large transformational programs in the capacity of an architect • Ability to effectively summarize and present complex technical information to cross-functional groups and senior decision-makers • Lateral thinking skills • Leadership skills • Stakeholder management • Excellent articulation skills","Skill Content Management ,Ontology Management,Content EnrichmentLocation New York, NYTotal Experience 8 yrs.Max Salary $ DOE Per HourEmployment Type Direct Jobs (Full Time)Domain Any",,0,1,0,Full-time,Mid-Senior level,Bachelor's Degree,Information Technology and Services,Information Technology,0
829,Graduates: English Teacher Overseas,"ZA, WC, Cape Town",,,We help teachers get safe &amp; secure jobs abroad :),"Play with kids, get paid for it :-)Love travel? Jobs in Asia$1500 USD + monthly ($200 Cost of living)Housing providedAirfare ReimbursedExcellent for student loans/credit cardsGabriel Adkins : #URL_ed9094c60184b8a4975333957f05be37e69d3cdb68decc9dd9a4242733cfd7f7##URL_75db76d58f7994c7db24e8998c2fc953ab9a20ea9ac948b217693963f78d2e6b#",University degree required. TEFL / TESOL / CELTA or teaching experience preferred but not necessarySouth African passport only. Please include the country code (+27) when entering your phone number on the application,See job description,0,1,0,Contract,,Bachelor's Degree,Education Management,,0
7780,Outbound Telesales Agent,"GB, NET, ",Sales,,"Screach makes your whole world interactiveScreach is a discovery engine that opens a whole new dimension to the things you love. Whether you’re at home watching TV, out shopping, enjoying a drink with friends, or exploring a new city, Screach gives you cool new ways to make those experiences interactive, social and rewarding.ScreachTV is the newest evolution of our platform &amp; the future of in-venue entertainment Using ScreachTV, create your own beautiful, local, personalised, interactive TV channel that makes you money and engages with your customers to turn your screens from background noise into something useful when there is nothing of interest to show on them. Reward each and every customer with a personalised offer that keeps them in your venue longer and brings them back time and time again. When there is no live sport on the TV, don't just leave your screens turned off, make your screens work for you as finally there is something good to put on the screen.","We’re looking for aTelesales Agent to join our team…Are you an ambitious individual with a passion for securing new business and delivering an excellent customer experience? Interactive technology company Screach are looking for a Telesales Agent to join our growing team in Newcastle upon Tyne….What you'll be doing: You will be part of the outbound sales team, responsible for making appointments for our ScreachTV sales representatives – this role will include: -       Making outbound sales calls to identify new business opportunities-       Presenting the product and establishing interest in the ScreachTV platform-       Customer evaluation and procurement-       Booking meetings for our regional sales reps-       Report data and offer feedback to management","What you need for this position:-       The ability and desire to sell-       Excellent communication skills-       Articulate and professional phone manner-       Well organised and able to build rapport quickly-       A confident and determined approach-       A high degree of self-motivation, drive and resilience-       The ability to work both independently and as part of a small, energetic team-       The capacity to flourish in a competitive environment-       The drive to reach and exceed targets-       Experience in a telesales environment ","Permanent, full time roleStart date - as soon as possible£12,000 - £16,000 per annum, based on experience + commission**Applications only open to direct candidates – STRICTLY NO AGENCIES**",0,1,1,,,,,,0
