job_id,title,location,department,salary_range,company_profile,description,requirements,benefits,telecommuting,has_company_logo,has_questions,employment_type,required_experience,required_education,industry,function,fraudulent
6386,Mid-Senior Level PHP Developer,"US, NY, Brooklyn",IT,70-100,"Focus Camera is a family owned and operated nationwide specialty on-line retailer.  Our roots are in a brick-and-mortar retail, operating in the same New York neighborhood location for over 40 years. We have taken our consumer-oriented philosophy that has served us well in our local community, and expanded it to serve customers nationwide.Customer Service is our #1 priority. We make customers; not just sales. Our customers are our investment. “Treat every customer as if they sign your paycheck…because they do.” This has been our credo, and it is for this reason that many of our orders are from repeat customers.We carry a wide range of all brand-name photographic products, including digital cameras and camcorders, digital frames, and photo printers.  In addition, we carry consumer electronics, optics equipment such as binoculars and telescopes, and some kitchen and home appliances.Our prices are very competitive. We sell only top-quality merchandise, and our customer service is second to none. Join our family of satisfied customers, and you will be glad you did. In fact, our best advertisers are our satisfied customers, more than 400,000 strong, and growing daily.",Brooklyn based eCommerce Company seeking Full Time In House Mid – Senior level PHP Developer. You will be responsible for supporting and enhancing our Multi-store Magento platform and inhouse applications. ,PHP OOPMagento eCommerce PlatformKnowledge of PHP Frameworks such as Zend or CodeigniterMVC Design experienceRest/Soap APIsMYSQL and MSSQL,,0,1,1,Full-time,Mid-Senior level,,Internet,Information Technology,0
5043,Senior Front End Engineer,"US, CA, San Francisco",Engineering,,"AGOGO creates a personalized audio channel by bringing together your favorite programming -- news, entertainment, sports, and more -- with your premium music services, personalized traffic, audio books, video programming, and much more. Curated from the freshest, most trusted sources, AGOGO helps you make the most out of every waking moment.AGOGO is looking for people who are media aware, know technology inside and out, who are ambitious, a team player, and looking to grow with a company.","About AGOGOAGOGO is a personalized audio service that brings together your favorite programming -- news, entertainment, sports, and more -- with your premium music services, personalized traffic, audio books, video programming, and much more. Curated from the freshest, most trusted sources, AGOGO helps you make the most out of every moment, by channeling your world.You AreWe are looking for a great front-end developer who is also comfortable in the full stack. You will be working closely with designers and other developers working to bring the AGOGO experience to the web. This is an opportunity to create an awesome web experience that influences the way that we navigate and consume audio content. If you are interested in creating a standards-based, multimedia experience on the web using cutting-edge frameworks and development methodologies, this is for you!What You'll Be DoingImplementing, and maintaining features for our internal and consumer-facing web applications.Working with the Product and Design teams to design and spec new functionality.The Ideal CandidateYou have 3+ years of web development experience.You are proficient writing HTML5 web apps and have written enough JavaScript to love it.You have experience working with Ruby on Rails and are eager to learn more.You have experience implementing responsive designs for different screens and devices.You have experience with writing features specs and unit tests.You have an eye for design and can share the vision for the product.You have a strong desire to learn new languages and technologies.",,,0,1,0,Full-time,,,Computer Software,Engineering,0
4863,Sr. Security Developer,"US, NY, New York",,,"We design, deploy, and maintain advanced technologies that enable our customers to achieve operational excellence at substantial OpEx savings. Our core strengths include a concentration on networks, their security &amp; optimization with a laser focus on redefining the fulfillment experience. We are driven to add value at every step by providing access to inventory, streamlined credit, integration with your procurement organization and real time status information. These are all reflective of our value-added philosophy.We have developed solutions for leaders from Wall Street to the Web. What makes us different is our concentration and commitment to exclusive relationships with leading vendors.","We are looking for highly skilled developer with security background to join a fast-paced, dynamic and challenging environment managing a global cutting edge security infrastructure. The role is for an expert with Kerberos, authentication technologies and protocols in general, and Unix system security. The ideal candidate must have a very strong technical foundation in networking and Unix systems. This is a deeply technical role requiring enterprise experience and suited to a true product/subject matter expert.We're seeking extremely motivated, self-directing individuals that demonstrate a natural curiosity and innate interest in technology and security. All candidates must possess a sincere interest in the technological beyond their day to day work responsibilities. Candidates must demonstrate very strong conceptual understanding of security and networking and the ability to work in a global team environment.This is for direct full time employment in midtown Manhattan. Salary is open, based on experience.","Practical Knowledge &amp; Experience:Solid understanding in one or more: Kerberos, RADIUS, SecurID, identity managementSolid understanding of common network and system attack methodsSolid understanding of security best practicesExpert level PERL programmingStrong C programmingStrong Unix system backgroundStrong knowledge of Unix networking (sockets)Solid understanding of IP networking (TCP/IP and standard services)Interoperability between Unix and Windows authenticationChallenges in identity managementKnowledge of SPNEGO, SAML, single-signon, multi-factor authenticationAbility to write technical and operations documentationAbility to describe technical concept verbally and on paperExcellent communication skills, both spoken and written","At Fivesky, our employees are our greatest asset and the focal point around which we operate, therefore, we always want the best for our employees.  In addition to offering competitive compensation plans and long-term career opportunities.  We offer an attractive mix of benefit plans to our employees that include: a health plan, 401k, provisions for vacation, holiday pay, and sick days.  Employees qualify to join these plans and other sponsored benefits after 90-days of employment.Fivesky is an equal opportunity employer and will consider all applications without regard to race, sex, age, color, religion, national origin, veteran status, disability, genetic information or any other characteristic protected by law.",0,1,1,Full-time,Mid-Senior level,Bachelor's Degree,Information Technology and Services,,0
16894,25 CLIENT SUPPORT OFFICERS HIRING : IMMEDIATELY PLACING,"US, NC, Raleigh",,,"LEI Home Enhancements, is an Ohio based company that has been installing windows, siding, doors and decks in homes throughout the Tri-state, Dayton, Indianapolis and Columbus for over seven years.With pride in our work, honesty and integrity in our professionalism and a companywide dedication to customer satisfaction, we offer a wide range of remodeling services to homeowners.Whether your project is large or small, we understand the trust and confidence each customer places in our skilled hands.  That's why we use only superior quality products and exceptional craftsmanship to achieve long-lasting beauty, performance and value for your home.  We take every measure to carefully ensure our craftsman are properly trained in all phases of home improvement.  Likewise, our sales staff and customer service representatives draw upon their years of experience for quality installations.From day one, we will welcome any questions and concerns you may have during the renovation process.  It is our goal to provide you with beautiful and practical home improvements that will stand the test of time, along with the peace of mind that you have made an excellent selection for your home.","DescriptionLEI Home Enhancements is hiring for ENTRY LEVEL customer service positions. We have an aggressive expansion plan laid out and are looking to find a person who would love to work in a fun, competitive, positive-minded environment.What We Do:LEI Home Enhancements is a marketing firm that deals with home improvement products.Why We Are Hiring: We are located in 8 cities and expanding to 15 this year. Therefore, our goal is to find a few people to  help in our expansion efforts. The people we hire will have a chance to get in entry level management training within the next 2 months and have unlimited growth opportunity.","Our Management Training Program focuses on the following areas:Sales and Marketing Leadership Skills Effective Communication Techniques Marketing Campaign Roles Sales Strategies Team ManagementRequirementsWho We're Looking For: You must possess great people skills. You must demonstrate excellent work ethic. You must have a positive business attitude like the rest of our enthusiastic staff. You must be confident you'll be successful, just waiting for a career opportunity where you can prove yourself.",BenefitsWe Offer: Weekly Base plus commissions (approx $18-$22 an hour plus commissions) Paid training Full Benefits,0,1,0,,,,Consumer Services,Customer Service,0
2361,Junior Account Manager (f/m),"DE, HH, Hamburg",Account,,"Goodmates is a studio for digital communication with the three main pillars strategy, conception and design. We believe in marketing in a digital world.","Manage and implement innovative solutions for our mostly digital oriented clientsLead projects with a structured approach and ""healthy paranoia""Support the management team with the preparation of presentations and pitches",Degree in Economics or Communication Sciences or equivalent educationAt least one year of relevant work experienceExperience and safety in controlling budgetsAbove-average flair for clients and brandsPassion for good advertisingStrategy and presentation skills Understanding of integrated communication conceptsAbility to solve problems creatively and effectivelyPassion for technologyHigh degree of pro-activeness and motivationEnjoys working in a team environment,Get to be part of something amazing. With real impact. Now.,0,1,0,Full-time,Entry level,Bachelor's Degree,Marketing and Advertising,Advertising,0
10548,Designer (Senior and Junior),"GB, , London",,,"We believe cities are complicated. And your mobile device should save you from the everyday challenges of living in them.We're a small dedicated team based somewhere in London with backgrounds in transport, Google, apps, design, investing and academia. We're venture capital backed by a number of fancy pants investors including Balderton Capital, Index Ventures, Greylock Partners, Connect Ventures as well as some angels.We're motivated by solving hard fundamental everyday problems that improve the quality of people's lives. We like simplifying complexity, reinventing user experience, working with data, shipping fast, and humanising a serious space.We're hiring now!","We're a design driven company building one of the most important apps on mobile (iOS, Android) and the web. This is an opportunity to be part of a small team reinventing a category, and to affect the everyday life of active users around the world. - Cover a broad range of skill sets: interaction design, UX, visual, information, data, marketing.- With strong focus and interest in mobile UI and data-driven information design.- On all platforms (iOS, Android, Web) including future ones (kiosks, wearables).- Experience/ familiarity working with engineers and software cultures. - Care about the city, mobile, open data, transport, creativity, culture, building great user experiences.- Understand and extend our brand style and voice.- Broad knowledge of design / prototyping tools.",,,0,1,1,,,,,,0
3789,Work at Home - Business Owner,"AU, NT, ",,,"We are looking for passionate individuals who will partner with us and ensure the long-term success of our business and their own.This business is suited to Sales professionals, Executives, Entrepreneurs, Retired business owners, Couples wishing to work together, Stay at home parents, Single parents, Baby boomers, anyone over 18 years of age who wants to improve their lifestyle and income. Experience is not essential but the mindset of a professional and the openness to seek new opportunities in Personal growth and financial independence is a must.We will work very closely with you to teach you step by step how to become successful. You will grow, learn and develop as you work towards becoming financially free. You will receive full training &amp; ongoing mentoring. You will be in business for yourself, but not by yourselfYou will need to commit yourself to at least 15 to 20 hours a week.Please only apply for this opportunity you have a strong desire to create wealth and if you are serious about starting your own business from home.Also note: starting your own business requires capital investment both initially and on an ongoing basis.","We are looking for passionate individuals who will partner with us and ensure the long-term success of our business.This business is suited to Sales professionals, Executives, Entrepreneurs, Retired business owners, Couples wishing to work together, Stay at home parents, Single parents, Baby boomers, anyone over 18 years of age who wants to improve their lifestyle and income. Experience is not essential but the mindset of success and the openness to seek new opportunities in Personal growth and financial independence is a must.We will work very closely with you to teach you step by step how to become successful. You will grow, learn and develop as you work towards becoming financially free. You will receive full training &amp; ongoing mentoring. You will be in business for yourself, but not by yourselfYou will need to commit yourself to at least 15 to 20 hours a week.Please only apply for this opportunity you have a strong desire to create wealth and if you are serious about starting your own business from home","Computer, TelephoneYou will need to commit yourself to at least 15 to 20 hours a week.Also note: starting your own business requires capital investment both initially and on an ongoing basis.","• Potential to earn an executive level income • Full training &amp; support from experienced professionals • Work from anywhere in the world with your laptop &amp; phone • Simple 3 Step System • Ability to earn immediate income • Unlimited income potential / highly profitable • Fun, rewarding &amp; engaging • No monthly products to purchase, no cold calling or contacting your family or friends",0,1,1,,,,,,0
14739,Sale Representatives,"US, IL, Chicago",,,"Providing luxurious menswear such as suits, shirts, neckwear and accessories for the tailored gentleman. ","Sales Representative Job Purpose: To serve customers by selling products and meeting customer needs.Sales Representative Job Duties:Services existing customers, obtains orders, and establishes new customers by planning and organizing daily work schedule to call on existing or potential sales Submits orders by referring to price lists and product literature.Keeps management informed by submitting activity and results reports, such as daily call reports, weekly work plans, and monthly and annual territory analyses.Monitors competition by gathering current marketplace information on pricing, products, new products, delivery schedules, merchandising techniques, etc.Recommends changes in products, service, and policy by evaluating results and competitive developments.Resolves customer complaints by investigating problems; developing solutions; preparing reports; making recommendations to management.Maintains professional and technical knowledge by attending educational workshops; reviewing professional publications; establishing personal networks; participating in professional societies.Provides historical records by maintaining records on area and customer sales.Contributes to team effort by accomplishing related results as needed.",Our website is under construction. Take a moment to review the products we offer via Instagram (@alonzo_gregory). #URL_72ce1df7ac19ca874c46ac6dea942a643783ab5c589d68b84fcc6cc077ef810a# ,"GREAT COMMISSION ONLY TERMS- Total Sales Per Month (Commission Rate) - $1 to $49,999 - (12%) $50,000 to $74,999 - (14%)$75,000 to $124,999 - (16%) $125,000 or more - (18% + 3% Quarterly Bonus)",0,1,0,Full-time,Mid-Senior level,Unspecified,Retail,Sales,0
9646,iOS Senior Software Engineer,"EG, ALX, Alexandria",iOS,,"BADR is an established company that is striding in to the world of big-data with formal expertise and the right technology for the job. Our vision is to become the leading big-data visualization and analytics services provider in the Middle East, and this is a goal that we strongly believe to be reachable. With a dedicated team and the tools required, we plan to change big-data in a big way.Despite our relative freshness to the field, we have the advantage of a dedicated and experienced team. Our team is a family at Badr and company culture is very important to us. We have a jolly band of geeks in the office who are all working towards a common goal. Our diverse and varying team all have a wealth of skills and knowledge that they bring to the table and this diversity helps exponentially in our ability to take on any challenge that we are faced with.Looking to the present as well as the future, our company is extremely dedicated in helping our youth and local communities in any way that we can. We frequently hold sessions educating the youth on the modern business world and the skills that they will need in it. It is our goal to equip our young adults for the future that they’ll be shaping and this is a cause that is very important to us. ","If you are a Senior Software Engineer with extensive Cocoa experience, please read on!We are seeking to hire a Senior Software Engineer to design and develop advanced features and help take us to the next level!! Responsibilities:Design and develop advanced features for iOS developers and for our technology platform using your Mac OSX and iOS development skills.Work on ""plugins"", and/or ""libraries"" for IOS apps as well as a Mac desktop that both interact heavily with our server API. Create designs for complex features and communicate them effectively with both technical and business folks.Write well documented, highly maintainable code.Use your talent for innovation, problem solving savvy and technical skills to transform complex concepts into clean, easy to use features for a variety of global audiences.- Use your excellent communication and interpersonal skills to drive on time completion of your own and team tasks in an Agile environment.Be our iOS expert.Work well within a small, highly performing, team.Nice to have some UI/UX skills on the client app side so we don't build ugly, clunky apps.A bonus would be Windows and Android since we will be supporting those platforms in the future. Design and develop advanced features for iOS developers and for our technology platform using your Mac OSX and iOS development skills.Work on ""plugins"", and/or ""libraries"" for IOS apps as well as a Mac desktop that both interact heavily with our server API. Create designs for complex features and communicate them effectively with both technical and business folks.Write well documented, highly maintainable code.Use your talent for innovation, problem solving savvy and technical skills to transform complex concepts into clean,easy to use features for a variety of global audiences.Use your excellent communication and interpersonal skills to drive on time completion of your own and team tasks in an Agile environment.Be our iOS expert.Work well within a small, highly performing, team.Nice to have some UI/UX skills on the client app side so we don't build ugly, clunky apps.A bonus would be Windows and Android since we will be supporting those platforms in the future. ","At Least 3 Years of experience and knowledge of:Strong Cocoa + Cocoa frameworks experience.Writing apps for Mac OS X.Objective-C programming.API's with iOS.Client-Server Architecture.Mobile UI development.Apple iOS/Mac platform.Writing interfaces for C and Object Oriented Languages (Objective-C, C++, Java).Good working knowledge of XML.Experience using Version Control - GIT or CVS.",,0,1,0,Full-time,Associate,Bachelor's Degree,Information Technology and Services,Engineering,0
10280,Customer Service Rep (Video Games),"US, MO, Maryland Heights",CS,0-0,"Controller Chaos opened for business in early 2008 to fill a void we saw in the gaming world - quality modded controllers. Our goal wasn’t just to provide gamers with quality controllers that were outfitted with all the latest technology, we wanted to provide gamers with the largest selection of modded controllers AND back it with exceptional customer service.Since then, we have grown almost as quickly as our customer base has. We have established ourselves as an industry leader and are accredited by the Better Business Bureau as a registered corporation in the state of Missouri. ","We are a small dot com start-up based out of Maryland Heights Missouri seeking customer service associates for the holiday season (Oct-Feb). This is a full time position (with overtime) and open immediately.Job Description:- Handle incoming emails, live chat, and phone calls- Keep records of customer interactions, transactions, recording details of inquiries- Work with production team to resolve any issues with specific customer orders.- Other job duties as assignedCandidate Requirements:- Knowledgeable with FPS Games (Call of Duty,Battlefield, Etc)- Knowledgeable with XBOX/PlayStation consoles- Call center or equivalent phone/email experience- Typing: 45-60 WPM (Words Per Minute)- Excellent verbal, written and skills- Effective email, phone, and computer skills- Self motivated and quick learner- Pass background and drug screening- High School Diploma- U.S. Citizenship or Permanent Resident.Working Environment:- Opportunity for advancement- Work casual atmosphere- Casual dress- High energy / fast paced environmentHours &amp; Compensation:- Monday - Friday (Overtime and Weekends If Needed)- Hourly Wage: $9.50 hour About Our Company:Controller Chaos specializes in custom built controllers for the Xbox and PlayStation consoles. We are on the bleeding edge of the latest technical advancements in the video game industry.",,,0,1,1,Full-time,Entry level,High School or equivalent,Consumer Services,,0
